{
  "$schema": "../manifest.schema.json",
  "id": "jira",
  "version": "1.0.0",
  "label": "Jira",
  "status": "recognised",
  "why": "There's no Jira connector yet: a worker can't sign in to Jira or read or change anything in it.",
  "owner": {
    "team": "Worker platform",
    "accountable": "Sabir Nawaz"
  },
  "review": "platform",
  "tests": [
    "bench/integrations/catalog-test.mjs"
  ],
  "workspace": "any",
  "detect": [
    "jira"
  ],
  "capabilities": [],
  "base": {
    "enables": [],
    "core": [],
    "requires": []
  },
  "instructions": {
    "steps": [],
    "limits": [],
    "starters": []
  },
  "questions": [],
  "config": {
    "schema": {
      "type": "object",
      "additionalProperties": false,
      "properties": {}
    }
  },
  "relations": []
}
